[
  {
    "id": "CONCEPT-001",
    "title": "所有废案，归我所有",
    "logline": "旧图纸修复员能把被取消、却曾试制合格的零件从原图上取下来。",
    "primary_pleasure": "创造与建设",
    "protagonist_goal": "让被放弃的公共方案真正改善生活",
    "mechanism_summary": "从原始旧图兑现被取消的合格部件，再通过专业合作完成实际工程。每次成功改变哪些方案值得重启，而不是简单抽奖。",
    "first_payoff": "纸上的零件进入掌心，停水的泵房恢复供水。",
    "unique_scene": "原图的部件线条消失，同一只空杯被清水装满；工程师主动开放档案。",
    "serial_engine": "旧档案核验、部件组合、建设条件、协作选择与公共影响不断产生不同问题。",
    "risk": "不能让任何涂鸦都变成万能实物，也不能把城市建设缩成按一下按钮。",
    "fingerprint": {
      "desire": [
        "创造建设"
      ],
      "advantage": [
        "历史设计兑现"
      ],
      "operation": [
        "取消图纸取物"
      ],
      "obstacle": [
        "资源缺件"
      ],
      "relationship": [
        "专业合作"
      ],
      "reveal": [
        "行动验证"
      ],
      "reward": [
        "生活改善"
      ],
      "growth": [
        "部件组合到公共工程"
      ],
      "arena": [
        "架空城市"
      ]
    },
    "variant_of": null
  },
  {
    "id": "NEGATIVE-RENAME-001",
    "title": "所有星图废案，归我所有",
    "logline": "把城市和零件改名为星港和星核，其余因果不变的反例。",
    "primary_pleasure": "创造与建设",
    "protagonist_goal": "让被放弃的公共方案真正改善生活",
    "mechanism_summary": "从原始旧图兑现被取消的合格部件，再通过专业合作完成实际工程。每次成功改变哪些方案值得重启，而不是简单抽奖。",
    "first_payoff": "纸上的零件进入掌心，停水的泵房恢复供水。",
    "unique_scene": "原图的部件线条消失，同一只空杯被清水装满；工程师主动开放档案。",
    "serial_engine": "旧档案核验、部件组合、建设条件、协作选择与公共影响不断产生不同问题。",
    "risk": "不能让任何涂鸦都变成万能实物，也不能把城市建设缩成按一下按钮。",
    "fingerprint": {
      "desire": [
        "创造建设"
      ],
      "advantage": [
        "历史设计兑现"
      ],
      "operation": [
        "取消图纸取物"
      ],
      "obstacle": [
        "资源缺件"
      ],
      "relationship": [
        "专业合作"
      ],
      "reveal": [
        "行动验证"
      ],
      "reward": [
        "生活改善"
      ],
      "growth": [
        "部件组合到公共工程"
      ],
      "arena": [
        "架空城市"
      ]
    },
    "variant_of": null
  }
]
